,Review,Liked
313,আর ফিরে যাচ্ছি না।,0
314,"দামের জন্য দুর্দান্ত খাবার, যা খুব উচ্চ মানের এবং বাড়ি তৈরি।",1
315,অন্যদিকে বাসের ছেলেটি এতটা অভদ্র ছিল।,0
316,"এই মুহুর্তে, আমার বন্ধুরা এবং আমি মূলত এই জায়গাটি একটি রসিকতা খুঁজে পেয়েছি এবং এটি প্রকাশ্যে এবং উচ্চস্বরে জানাতে আপত্তি করিনি।",0
317,"ভাল বিবিকিউ, হালকা ভাড়া, যুক্তিসঙ্গত মূল্যে ফিরে যান এবং জনগণকে জানান যে তারা পুরানো উপায়ে ফিরে এসেছে।",1
318,এবং আমরা দু'জনকে সেখানে প্রায় পুরো 20 ডলারের জন্য খুব পূর্ণ এবং খুশি রেখে বিবেচনা করে আপনি ভুল করতে পারবেন না।,1
319,ঘরে বসে সব রুটি বানানো হয়!,1
320,একমাত্র নেতিবাচকতা পরিষেবা।,0
321,"এছাড়াও, ফ্রাই সন্দেহ ছাড়াই আমার মধ্যে সবচেয়ে খারাপ ফ্রাই হয়েছে।",0
322,পরিষেবাটি ব্যতিক্রমী ছিল এবং সমস্ত পর্যালোচনা হিসাবে খাবারটি ভাল ছিল।,1
323,"কয়েক মাস পরে, আমি ফিরে এসেছিলাম এবং একটি দুর্দান্ত খাবার খেয়েছি।",1
324,শাওয়ার্রrrrma এর জন্য শহরে প্রিয় জায়গা !!!!!!,1
325,কালো চোখের মটর আর মিষ্টি আলু ... অবাস্তব!,1
326,আপনি হতাশ হবেন না।,1
327,তারা কেবল ভিনিগ্রেট দিয়ে এটি পরিবেশন করতে পারে এবং এটি আরও ভাল সামগ্রিক থালা তৈরি করতে পারে তবে এটি এখনও খুব ভাল ছিল।,1
328,"আমি অনেক অনেক জায়গায় গিয়েছি এবং আমি কোনও রেস্তোঁরা কখনও দেখিনি যা 1 ডিমের নাস্তা পরিবেশন করে, বিশেষত $ 4.00 এর জন্য।",0
329,আমার মা এবং আমি বাড়িতে এলে তিনি তত্ক্ষণাত্ অসুস্থ হয়ে পড়েছিলেন এবং তার কাছে কেবল কয়েকটি সালাদ ছিল।,0
330,সার্ভারগুলি মোকাবেলা করতে সুন্দর নয় এবং তারা সর্বদা পিজা হট কুপনগুলিকে সম্মান করে না।,0
331,"উভয়ই সত্যই অবিশ্বাস্যরূপে ভাল ছিল, এবং আমি ফিরে এসেছি বলে আমি খুব আনন্দিত।",1
332,"আমাদের দুর্দান্ত সেবা ছিল, এবং বায়ুমণ্ডলে খুশি হয়েছিল।",1
333,সবকিছু স্থূল ছিল।,0
334,আমি এই জায়গা ভালবাসা.,1
335,দুর্দান্ত পরিষেবা এবং খাবার।,1
336,প্রথম - এই জায়গায় বাথরুমগুলি ময়লা ছিল - আসনগুলির কভারগুলি পুনরায় পূরণ করা হয়নি এবং কেবল সরল ইয়াকি !!!,0
337,"বার্গার ... আমি ""গোল্ড স্ট্যান্ডার্ড"" এ 17 ডলার বার্গার পেয়েছি এবং একরকম হতাশ হয়েছিলাম।",0
338,"ওএমজি, খাবারটি ছিল ডিলিসিও!",1
339,এই জায়গা সম্পর্কে খাঁটি কিছু নেই।,0
340,স্প্যাগেটি কিছুই বিশেষ নয়।,0
341,"সমস্ত খাবারের মধ্যে, স্যামনটি সেরা ছিল, তবে সমস্ত দুর্দান্ত ছিল।",1
342,সবজিগুলি এত তাজা এবং সসটি খাঁটি থাইয়ের মতো অনুভব করে।,1
343,এটি টাকসন থেকে গাড়ি চালানোর পক্ষে মূল্যবান!,1
344,নির্বাচনটি আমি ভ্যাগাসে সবচেয়ে খারাপ দেখেছি ..... সেখানে কিছুই ছিল না।,0
345,খুব ভাল বিয়ার নির্বাচন।,1
346,এই জায়গাটি চিপটলের মতো তবে আরও ভাল।,1
347,"উত্কৃষ্ট / উষ্ণ বায়ুমণ্ডল, মজাদার এবং তাজা ক্ষুধা, সুস্বাদু স্টিকস (বেসবল স্টেক !!!!!",1
348,ইট ওভেন রুটির অ্যাপের জন্য পাঁচ তারা!,1
349,আমি এখানে একাধিকবার খেয়েছি এবং প্রতিবারই খাবারটি সুস্বাদু ছিল।,1
350,আমরা আরও দশ মিনিট বসে অবশেষে হাল ছেড়ে দিয়ে চলে গেলাম।,0
351,সে ছিল ভয়ানক!,0
352,প্রত্যেকেই সমান বিশেষ বলে বিবেচিত হয়।,1
353,প্যানকেকস এবং ডিমের জন্য 30 মিনিট সময় নেওয়া উচিত নয়।,0
354,এটা সুস্বাদু ছিল!!!,1
355,"ভাল দিক থেকে, কর্মীরা প্রকৃতপক্ষে আনন্দদায়ক এবং উত্সাহী ছিলেন - একটি বাস্তব ট্রিট।",1
356,"দুঃখের বিষয়, গর্ডন রামসির স্টেক এমন এক স্থান যা আমরা ভগাসের পরবর্তী ভ্রমণে তীব্রভাবে এড়ানো উচিত avoid",0
357,বরাবরের মতো সন্ধ্যাটি দুর্দান্ত এবং খাবারটি সুস্বাদু ছিল!,1
358,আমার জীবনে সবচেয়ে ভাল মাছ ছিল!,1
359,(বাথরুম ঠিক পাশের দরজা এবং খুব সুন্দর।),1
360,বুফেটি ছোট এবং তাদের দেওয়া সমস্ত খাবারই ছিল বিএল্যান্ড B,0
361,এটি আমার স্বাদযুক্ত কিছু সেরা খাবারের সাথে একটি বাহ্যিক ছোট রেস্তোঁরা।,1
362,খুব সুন্দর আমি বলব।,1
363,অবশ্যই আমার জন্য একটি অফ অফ এবং আমি সন্দেহ করি যে অন্য কেউ কেনা না হলে আমি ফিরে আসব।,0
364,সার্ভার আমাদের বৃহত রাউডি টেবিলটি পরিচালনা করে দুর্দান্ত কাজ করেছে।,1
365,আমি খাবারকে নষ্ট করার মতো মনে করি তবে এটি কেবল খাদ্য ছিল না।,0
366,আমার স্ত্রীর কাছে লবস্টার বিস্কু স্যুপ ছিল যা ছিল হালকা।,0
367,ভ্যাগাসে থাকাকালীন আমার যদি সুশী তৃষ্ণা হয় তবে আবার ফিরে আসব।,1
368,"কর্মীরা দুর্দান্ত, উচ্চাভিলাষ দুর্দান্ত।",1
369,তিনি পাঁচটি তার প্রাপ্য।,1
370,আমি পেটে ব্যথা নিয়ে চলে গেলাম এবং সারা দিন অসুস্থ বোধ করলাম।,0
371,তারা বলের চেয়ে বেশি বাদ পড়েছে।,0
372,"ডাইনিং স্পেস ছোট, তবে মার্জিতভাবে সজ্জিত এবং আরামদায়ক।",1
373,"তারা আপনার অর্ডারটি আপনার পছন্দ অনুযায়ী যে কোনও উপায়ে কাস্টমাইজ করবে, আমার স্বাভাবিকটি হল সবুজ বিনের সাথে বেগুন হ'ল ভাজুন, এটি পছন্দ করুন!",1
374,এবং মটরশুটি এবং চাল সবচেয়ে ভাল ছিল মাঝারি।,0
375,শহরে সেরা টাকো এখন পর্যন্ত !!,1
376,আমি আমার টাকা ফিরিয়ে নিয়ে সেখানে চলে গেলাম।,0
377,"শহরের আকর্ষণীয় অংশে, এই জায়গাটি আশ্চর্যজনক।",1
378,রুড এবং একচেটিয়া পরিচালনা।,0
379,"কর্মীরা এখন তেমন বন্ধুত্বপূর্ণ নয়, পরিবেশন করার অপেক্ষা করার সময়গুলি ভয়াবহ, কেউ কেউ প্রথম 10 মিনিটের জন্য হাইও বলে না।",0
380,আমি ফিরে আসব না।,0
381,তাদের দুর্দান্ত ডিনার রয়েছে।,1
382,পরিষেবাটি বহিরাগত ছিল এবং আমি অবশ্যই হালিবটকে প্রস্তাব দিই।,1
383,খাবারটি ভয়ানক ছিল।,0
384,কখনও কখনও ফিরে আসবে না এবং অনেক লোককে যা বলা হয়েছে তা বলব না।,0
385,আপনার গাড়িটি সামনে না ভেঙে এবং আপনি অনাহারে না থাকলে আমি প্রস্তাব দিই না।,0
386,আমি প্রতিবার ভ্যাগাসে ফিরে আসব।,1
387,এই জায়গাটি এক তারার প্রাপ্য এবং খাবারের সাথে 90% করণীয় রয়েছে।,0
388,এটি একটি অপমানজনক।,0
389,পরের বার বোলিংয়ে ফিরে আসেন ডিফ,1
390,"আপনি যদি স্বাস্থ্যকর খাঁটি বা জাতিগত খাবার চান, তবে এই জায়গাটি চেষ্টা করুন try",1
391,আমি এখানে লেডিস নাইট এবং এডিডি তারিখের রাতে আসা অবিরত করব ... যে কেউ এই অঞ্চলে যারা আছেন তাদের কাছে এই জায়গাটি সুপারিশ করুন।,1
392,আমি অতীতে বেশ কয়েকবার এখানে এসেছি এবং অভিজ্ঞতাটি সর্বদা দুর্দান্ত।,1
393,আমরা স্টাফ করা থেকে দূরে চলে গেলাম এবং আমাদের প্রথম ভেগাস বুফের অভিজ্ঞতা সম্পর্কে খুশি।,1
394,পরিষেবাটি দুর্দান্ত ছিল এবং দামগুলি বেশ যুক্তিসঙ্গত বিবেচনা করে এটি ভেগাস এবং আরিয়ার ক্রিস্টাল শপিং মলের ভিতরে অবস্থিত।,1
395,"সংক্ষিপ্তসার হিসাবে ... খাবারটি অবিশ্বাস্য ছিল, নয়, অতিক্রান্ত ... তবে কিছুই বায়ুসংক্রান্ত পরিবেশন সরবরাহকারীর স্মৃতির মতো আমার কাছে আনন্দ আনেনি।",1
396,আমি সম্ভবত ইয়ানস যেতে খুব কম লোকের মধ্যে একজন এবং এটি পছন্দ করে না।,0
397,কিডোসের জন্য প্রচুর দুর্দান্ত সাইড ডিশ বিকল্প সহ বাচ্চাদের পিজ্জা হরহামেশাই হিট!,1
398,পরিষেবা নিখুঁত এবং পারিবারিক বায়ুমণ্ডলটি দেখতে সুন্দর।,1
399,পরিপূর্ণতা রান্না করা এবং পরিষেবা অনর্থক ছিল।,1
400,এটি কেবল হতাশার।,0
401,"সামগ্রিকভাবে, বাউচনে খাবারের মানের কারণে আমি খুব হতাশ হয়েছি।",0
402,আমি খারাপ হয়ে যাচ্ছি তা জানার জন্য আমাকে অ্যাকাউন্টেন্ট হতে হবে না!,0
403,"খাওয়ার দুর্দান্ত জায়গা, সান ফ্রান্সিসকো বে এরিয়ায় ছোট্ট মা এবং পপ শপগুলির কথা মনে করিয়ে দেয়।",1
404,আজ আমার প্রথম বুলডোগিস গুরমেট হট ডগের স্বাদ ছিল এবং আমি আপনাকে বলতে চাই যে আমি এটি কখনও সম্ভব বলে ভাবা চেয়ে বেশি ছিল।,1
405,খুব হতাশ বাম।,0
406,আমি অবশ্যই আবার শীঘ্রই আসব।,1
407,খাবারটি সত্যিই ভাল ছিল এবং আমি পূর্ণ ক্ষুদ্রতম পেয়েছিলাম।,1
408,পরিষেবা চমত্কার ছিল।,1
409,সময়ের মোট ওয়েস্ট।,0
410,আমি জানি না এটি কি ধরণের তবে তাদের কাছে সেরা আইসড চা রয়েছে।,1
411,"ক্ষুধার্ত হয়ে আসুন, খুশি এবং স্টাফ ছেড়ে দিন!",1
412,"পরিষেবার জন্য, আমি তাদের কোনও তারা দেই না।",0
413,আমি আপনাকে আশ্বাস দিতে পারি যে আপনি হতাশ হবেন না।,1
414,আমি কিছুটা খারাপ সেবা নিতে পারি তবে খাবারটি সফল হয়।,0
415,কোন খাঁজ খাওয়ার চেষ্টা করে ছেড়ে গেলাম (দাঁতে এখনও ব্যথাহীন),0
416,তবে এখন আমি পুরোপুরি উপার্জন করেছি।,0
417,আমি সত্যিই এখানে খাওয়া উপভোগ করেছি।,1
418,প্রথমবার যাচ্ছি তবে আমি মনে করি আমি দ্রুত একটি নিয়মিত হয়ে উঠব।,1
419,আমাদের সার্ভারটি খুব সুন্দর ছিল এবং যদিও তিনি আমাদের সমস্ত প্রয়োজনের সাথে কিছুটা অভিভূত দেখছিলেন তবে শেষ পর্যন্ত তিনি পেশাদার এবং বন্ধুত্বপূর্ণ ছিলেন।,1
420,আমার রাতের খাবারের সহযোগীরা আমাকে যা বলেছিল তা থেকে ... সুন্দর জমিন এবং স্বাদ সহ সবকিছু খুব তাজা ছিল।,1
421,"মাটিতে, আমাদের টেবিলের ঠিক পাশেই ছিল একটি বিশাল, গন্ধযুক্ত, পদক্ষেপযুক্ত এবং ট্র্যাক-সব জায়গাতেই সবুজ পাখির পোপের স্তূপ।",0
422,"তদতিরিক্ত, আপনি এমনকি ওয়েবসাইটে কয়েক ঘন্টা অপারেশনও খুঁজে পাবেন না!",0
423,আমরা এই জায়গাটি পছন্দ করার চেষ্টা করেছি তবে 10+ বারের পরে আমার মনে হয় আমরা তাদের সাথে শেষ করেছি।,0
424,কী ভুল ছিল!,0
425,অভিযোগ নেই!,1
426,এটি কিছু মারাত্মকভাবে ভাল পিজ্জা এবং আমি এই বিষয়টির একজন বিশেষজ্ঞ / অভিজ্ঞ।,1
427,ওয়েটার ছিল এক ঝাঁকুনি।,0
428,"স্ট্রাইক 2, যিনি ছুটে যেতে চান।",0
429,এগুলি আমার মধ্যে সবচেয়ে ভাল রেস্তোরাঁর মালিক।,1
430,আমি আর কখনও আসি না।,0
431,আমরা বিস্কুট পছন্দ করতাম !!!,1
432,পরিষেবাটি দ্রুত এবং বন্ধুত্বপূর্ণ।,1
433,একটি ক্ষুধার্তকে আদেশ দিয়েছিলেন এবং 40 মিনিট এবং তার পরে পিজ্জা আরও 10 মিনিট নেন।,0
434,তাই একেবারে চমত্কার।,1
435,এটি ছিল গা aw় একটি বিশাল বিশ্রী 1.5lb টুকরা যা 3/4 র্থ কান্ড এবং চর্বি ছিল।,0
436,অবশ্যই এখানে আবার ফিরে আসবে।,1
437,আমি স্টেইনারদের পছন্দ করি কারণ এটি অন্ধকার এবং এটি বারের মতো অনুভূত হয়।,1
438,বাহ খুব মশলাদার তবে সুস্বাদু।,1
439,আপনি যদি পরিচিত না হন তবে এটি পরীক্ষা করে দেখুন।,1
440,আমি আমার ব্যবসায় ডিনার ডলার অন্য কোথাও নিয়ে যাব।,0
441,আমি ফিরে যেতে চাই।,1
442,"যাইহোক, এই এফএস রেস্তোঁরাটিতে একটি দুর্দান্ত প্রাতঃরাশ / মধ্যাহ্নভোজন।",1
443,বিশেষ কিছু না.,0
444,সপ্তাহের প্রতিটি দিন তাদের একটি আলাদা চুক্তি হয় এবং এটি সমস্ত এত সুস্বাদু!,1
445,"নাশপাতি, বাদাম এবং বেকন এর সংমিশ্রণের উল্লেখ না করা একটি বড় বিজয়ী!",1
446,ফিরে হবে না।,0
447,সস ছিল স্বাদহীন।,0
448,"খাবারটি সুস্বাদু এবং কেবল যথেষ্ট মশলাদার, তাই আপনি যদি সেভাবে পছন্দ করেন তবে স্পাইসিয়ারের জন্য জিজ্ঞাসা করতে ভুলবেন না।",1
449,আমার রিবে স্টেক পুরোপুরি রান্না করা হয়েছিল এবং দুর্দান্ত ম্যাসকাইট স্বাদ ছিল।,1
450,আমি মনে করি না আমরা শীঘ্রই যে কোনও সময় ফিরে যাব।,0
451,খাবার খুব ভাল ছিল।,1
452,আমি একটি সুশীল যোগাযোগ থেকে দূরে কিন্তু আমি অবশ্যই ভাল খাবার এবং খারাপ খাবারের মধ্যে পার্থক্য বলতে পারি এবং এটি অবশ্যই খারাপ খাবার ছিল।,0
453,আমার খুব অপমান করা হয়েছিল।,0
454,আমি এখানে সর্বশেষ 3 বার মধ্যাহ্নভোজ খারাপ ছিল।,0
455,মুরগির ডানাগুলিতে আমি খেয়েছি এমন সবচেয়ে শুকনো মুরগির মাংস রয়েছে।,0
456,"খাবারটি খুব ভাল ছিল এবং আমি প্রতিটি মুখোমুখি উপভোগ করেছি, দম্পতিদের ছোট পরিবার গোষ্ঠীগুলির জন্য একটি উপভোগযোগ্য রিল্যাক্স ভেন্যু ইত্যাদি",1
457,নার্গিল - আমি মনে করি আপনি দুর্দান্ত।,1
458,দক্ষিণ-পশ্চিমের সেরা টেটার টটস।,1
459,আমরা জায়গা পছন্দ।,1
460,আমি যে $ 3 দিয়েছিলাম তা অবশ্যই মূল্যবান নয়।,0
461,ভ্যানিলা আইসক্রিম ক্রিমি এবং মসৃণ ছিল যখন লাভেরোল (চৌকস) প্যাস্ট্রি যথেষ্ট তাজা ছিল।,1
462,আমি সারাক্ষণ এজেডে আছি এবং এখন আমার নতুন স্পট রয়েছে।,1
463,ম্যানেজার সবচেয়ে খারাপ ছিল।,0
464,ভিতরে সত্যিই বেশ সুন্দর এবং খুব পরিষ্কার।,1
465,খাদ্য বকেয়া ছিল এবং দামগুলি খুব যুক্তিসঙ্গত ছিল।,1
466,আমি মনে করি না যে আমি খুব শীঘ্রই খাবারের জন্য কার্লির কাছে ফিরে যাব।,0
467,"এটি স্বীকৃতি পেতে 20 মিনিট সময় নিয়েছে, তারপরে আমাদের খাবার পেতে আরও 35 মিনিট সময় লেগেছে ... এবং তারা জিনিস ভুলে যেতে লাগল।",0
468,মার্জারিটাসকেও ভালোবাসি!,1
469,এটি আমার প্রথম এবং একমাত্র ভেগাস বুফে এবং এটি হতাশ হয়নি।,1
470,"খুব ভাল, যদিও!",1
471,এক ডাউন নোটটি হ'ল বায়ুচলাচল কিছু আপগ্রেডিং ব্যবহার করতে পারে।,0
472,দুর্দান্ত শুয়োরের মাংসের স্যান্ডউইচ।,1
473,এখানে আপনার সময় নষ্ট করবেন না।,0
474,"মোট অবকাশ, আমি বরং কেবল ক্যামেলব্যাক ফ্লাওয়ার শপ এবং কার্টেল কফিতে যেতে চাই।",0
475,"তৃতীয়ত, আমার বন্ধুর বার্গারে থাকা পনিরটি শীতল ছিল।",0
476,আমরা তাদের পিজ্জা এবং ব্রাঞ্চ উপভোগ করি।,1
477,স্টিকগুলি সমস্ত ভাল ছাঁটাই করা হয় এবং পুরোপুরি রান্না করা হয়।,1
