,Review,Liked
649,আমরা শীঘ্রই আর ফিরে যাব না!,0
650,Very Very Disappointed ordered the $35 Big Bay Plater.,0
651,বিশ্রামের জন্য দুর্দান্ত জায়গা এবং একটি দারুণ এক বার্গার এবং বিয়ার রয়েছে।,1
652,বসার জন্য পারিবারিক খাবার খাওয়ার জন্য বা কয়েক বন্ধুকে নিয়ে একত্রিত হওয়া এটি পারফেক্ট।,1
653,"তাদের খুব স্বাদ নয়, এবং খুব খারাপভাবে নির্মিত।",0
654,প্যাটিওয়ের আসনটি খুব আরামদায়ক ছিল।,1
655,ভাজা ভাতও শুকনো ছিল।,0
656,আমার প্রিয় ইতালিয়ান রেস্তোরাঁয় হাত!,1
657,"আমার বইটিতে এটি কেবল স্ক্রিম ""লেগিট"" ... এটি ভ্যাগাসেও বেশ বিরল।",1
658,এটি কেবল একটি মজাদার অভিজ্ঞতা ছিল না।,1
659,আমাদের অনুরোধ করা গান বাজানো ভায়োলিনবাদীদের একটি দুর্দান্ত জুটির সাথে পরিবেশটি দুর্দান্ত ছিল।,1
660,"আমি ব্যক্তিগতভাবে হুনমাস, পিটা, বাকলভা, ফালাফেলস এবং বাবা গানোউসকে ভালবাসি (তারা বেগুন দিয়ে কী করে তা অবাক!)।",1
661,"Very convenient, since we were staying at the MGM!",1
662,মালিকরা সুপার বান্ধব এবং কর্মীরা বিনয়ী।,1
663,দুজনই দুর্দান্ত!,1
664,সারগ্রাহী নির্বাচন।,1
665,মিষ্টি আলুর টটগুলি ভাল ছিল তবে পেঁয়াজের রিংগুলি পরিপূর্ণতা বা আমার কাছে যতটা কাছে ছিল তত কাছাকাছি ছিল।,1
666,কর্মীরা খুব মনোযোগী ছিল।,1
667,And the chef was generous with his time (even came around twice so we can take pictures with him).,1
668,"মালিক নবুতে কাজ করতেন, সুতরাং অর্ধেক দামের জন্য এই জায়গাটি সত্যিই অনুরূপ।",1
669,গুগল মাঝারি এবং আমি কল্পনা করি স্ম্যাশবার্গার পপ আপ হবে up,0
670,এখানে যেতে না।,0
671,আমি প্রতিশ্রুতি করছি তারা হতাশ হবে না।,1
672,একজন সুশীল প্রেমিক হিসাবে এই জায়গাটি সব উপায়ে এড়ানো উচিত।,0
673,কি দুর্দান্ত ডাবল পিজারবার্গার!,1
674,দুর্দান্ত সেবা এবং খাবার food,1
675,A fantastic neighborhood gem !!!,1
676,আমি ফিরে যেতে অপেক্ষা করতে পারি না।,1
677,প্ল্যান্টেইনগুলি আমি সবচেয়ে খারাপ স্বাদ পেয়েছি।,0
678,এটি দুর্দান্ত জায়গা এবং আমি এটির সুপারিশ করছি।,1
679,পরিষেবা ধীর এবং মনোযোগী ছিল না।,0
680,আমি তখন এটি পাঁচটি তারা দিয়েছি এবং আমি এখন 5 তারা দিচ্ছি।,1
681,আপনার কর্মীরা আমার চেয়ে নিজের সাথে কথা বলতে বেশি সময় ব্যয় করেন।,0
682,মিষ্টি: পান্না কোট্টা আশ্চর্যজনক ছিল।,1
683,"খুব ভাল খাবার, দুর্দান্ত পরিবেশ .1",1
684,ধিক্কার ভাল স্টেক।,1
685,মোট ব্রাঞ্চ ব্যর্থ।,0
686,"দামগুলি খুব যুক্তিসঙ্গত, স্বাদগুলি দাগযুক্ত, সস ঘরে তৈরি, এবং স্লো মায়োয় ভিজে যায় না।",1
687,"The decor is nice, and the piano music soundtrack is pleasant.",1
688,স্টেকটি আশ্চর্যজনক ছিল ... আরজি ফিললেট রিলেলেনো আমার কাছে সেরা সিফুড প্লেট ছিল!,1
689,"Good food , good service .",1
690,এটা একেবারে আশ্চর্যজনক ছিল।,1
691,"I probably won't be back, to be honest.",0
692,অবশ্যই ফিরে আসবে!,1
693,অজু সস সহ সার্জেন্ট মরিচ গরুর মাংসের স্যান্ডউইচ পাশাপাশি একটি দুর্দান্ত স্যান্ডউইচ।,1
694,"হাওয়াইয়ান ব্রীজ, ম্যাঙ্গো ম্যাজিক এবং আনারস ডেলাইট হ'ল স্মুদিগুলি যা আমি এ পর্যন্ত চেষ্টা করেছি এবং সেগুলি বেশ ভাল।",1
695,দুপুরের খাবারের জন্য গিয়েছিলাম - পরিষেবাটি ধীর ছিল।,0
696,"আমাদের হাঁটার আগে জায়গাটি সম্পর্কে আমাদের এতোটাই ছিল যে তিনি এটি আশ্চর্যজনক বলে প্রত্যাশা করেছিলেন, তবে দ্রুত হতাশ হয়েছিলেন।",0
697,I was mortified.,0
698,"বলা বাহুল্য, আমরা আর কখনও এখানে ফিরে আসব না।",0
699,"Anyways, The food was definitely not filling at all, and for the price you pay you should expect more.",0
700,যে চিপগুলি বেরিয়ে এসেছিল সেগুলি গ্রীস দিয়ে ফোঁটা ফোঁটা করছিল এবং বেশিরভাগই ভোজ্য ছিল না।,0
701,আমি স্ট্রিপ স্টেকের সাথে আসলেই মুগ্ধ হইনি।,0
702,2007 সাল থেকে চলে আসছে এবং প্রতিটি খাবার দুর্দান্ত হয়েছে !!,1
703,Our server was very nice and attentive as were the other serving staff.,1
704,The cashier was friendly and even brought the food out to me.,1
705,আমি প্যারাডাইজ ভ্যালিতে আতিথেয়তা শিল্পে কাজ করি এবং সিবোর আর কোনও পরামর্শ দেওয়া থেকে বিরত থাকি।,0
706,এখানকার পরিবেশটি মজাদার।,1
707,অন্যকে সুপারিশ করবে না।,0
708,"Service is quick and even ""to go"" orders are just like we like it!",1
709,"I mean really, how do you get so famous for your fish and chips when it's so terrible!?!",0
710,"That said, our mouths and bellies were still quite pleased.",1
711,Not my thing.,0
712,2 Thumbs Up!!,1
713,If you are reading this please don't go there.,0
714,"I loved the grilled pizza, reminded me of legit Italian pizza.",1
715,Only Pros : Large seating area/ Nice bar area/ Great simple drink menu/ The BEST brick oven pizza with homemade dough!,1
716,They have a really nice atmosphere.,1
717,Tonight I had the Elk Filet special...and it sucked.,0
718,"After one bite, I was hooked.",1
719,We ordered some old classics and some new dishes after going there a few times and were sorely disappointed with everything.,0
720,"Cute, quaint, simple, honest.",1
721,The chicken was deliciously seasoned and had the perfect fry on the outside and moist chicken on the inside.,1
722,"The food was great as always, compliments to the chef.",1
723,Special thanks to Dylan T. for the recommendation on what to order :) All yummy for my tummy.,1
724,Awesome selection of beer.,1
725,Great food and awesome service!,1
726,"One nice thing was that they added gratuity on the bill since our party was larger than 6 or 8, and they didn't expect more tip than that.",1
727,A FLY was in my apple juice.. A FLY!!!!!!!!,0
728,The Han Nan Chicken was also very tasty.,1
729,"As for the service, I thought it was good.",1
730,"The food was barely lukewarm, so it must have been sitting waiting for the server to bring it out to us.",0
731,Ryan's Bar is definitely one Edinburgh establishment I won't be revisiting.,0
732,Nicest Chinese restaurant I've been in a while.,1
733,"Overall, I like there food and the service.",1
734,They also now serve Indian naan bread with hummus and some spicy pine nut sauce that was out of this world.,1
735,"Probably never coming back, and wouldn't recommend it.",0
736,"Friend's pasta -- also bad, he barely touched it.",0
737,"Try them in the airport to experience some tasty food and speedy, friendly service.",1
738,I love the decor with the Chinese calligraphy wall paper.,1
739,Never had anything to complain about here.,1
740,The restaurant is very clean and has a family restaurant feel to it.,1
741,It was way over fried.,0
742,I'm not sure how long we stood there but it was long enough for me to begin to feel awkwardly out of place.,0
743,"When I opened the sandwich, I was impressed, but not in a good way.",0
744,Will not be back!,0
745,There was a warm feeling with the service and I felt like their guest for a special treat.,1
746,An extensive menu provides lots of options for breakfast.,1
747,"I always order from the vegetarian menu during dinner, which has a wide array of options to choose from.",1
748,"I have watched their prices inflate, portions get smaller and management attitudes grow rapidly!",0
749,Wonderful lil tapas and the ambience made me feel all warm and fuzzy inside.,1
750,"I got to enjoy the seafood salad, with a fabulous vinegrette.",1
751,"The wontons were thin, not thick and chewy, almost melt in your mouth.",1
752,"Level 5 spicy was perfect, where spice didn't over-whelm the soup.",1
753,We were sat right on time and our server from the get go was FANTASTIC!,1
754,"Main thing I didn't enjoy is that the crowd is of older crowd, around mid 30s and up.",0
755,"When I'm on this side of town, this will definitely be a spot I'll hit up again!",1
756,I had to wait over 30 minutes to get my drink and longer to get 2 arepas.,0
757,This is a GREAT place to eat!,1
758,The jalapeno bacon is soooo good.,1
759,The service was poor and thats being nice.,0
760,"Food was good, service was good, Prices were good.",1
761,The place was not clean and the food oh so stale!,0
762,"The chicken dishes are OK, the beef is like shoe leather.",0
763,But the service was beyond bad.,0
764,"I'm so happy to be here!!!""",1
765,Tasted like dirt.,0
766,One of the few places in Phoenix that I would definately go back to again .,1
767,The block was amazing.,1
768,"It's close to my house, it's low-key, non-fancy, affordable prices, good food.",1
769,* Both the Hot & Sour & the Egg Flower Soups were absolutely 5 Stars!,1
770,My sashimi was poor quality being soggy and tasteless.,0
771,Great time - family dinner on a Sunday night.,1
772,"the food is not tasty at all, not to say its ""real traditional Hunan style"".",0
773,"What did bother me, was the slow service.",0
774,The flair bartenders are absolutely amazing!,1
775,Their frozen margaritas are WAY too sugary for my taste.,0
776,These were so good we ordered them twice.,1
777,So in a nutshell: 1) The restaraunt smells like a combination of a dirty fish market and a sewer.,0
778,My girlfriend's veal was very bad.,0
779,"Unfortunately, it was not good.",0
780,I had a pretty satifying experience.,1
781,Join the club and get awesome offers via email.,1
782,"Perfect for someone (me) who only likes beer ice cold, or in this case, even colder.",1
783,Bland and flavorless is a good way of describing the barely tepid meat.,0
784,"The chains, which I'm no fan of, beat this place easily.",0
785,The nachos are a MUST HAVE!,1
786,We will not be coming back.,0
787,"I don't have very many words to say about this place, but it does everything pretty well.",1
788,"The staff is super nice and very quick even with the crazy crowds of the downtown juries, lawyers, and court staff.",1
789,"Great atmosphere, friendly and fast service.",1
790,When I received my Pita it was huge it did have a lot of meat in it so thumbs up there.,1
791,Once your food arrives it's meh.,0
792,Paying $7.85 for a hot dog and fries that looks like it came out of a kid's meal at the Wienerschnitzel is not my idea of a good meal.,0
793,The classic Maine Lobster Roll was fantastic.,1
794,"My brother in law who works at the mall ate here same day, and guess what he was sick all night too.",0
795,So good I am going to have to review this place twice - once hereas a tribute to the place and once as a tribute to an event held here last night.,1
796,"The chips and salsa were really good, the salsa was very fresh.",1
797,This place is great!!!!!!!!!!!!!!,1
798,Mediocre food.,0
799,Once you get inside you'll be impressed with the place.,1
800,I'm super pissd.,0
801,And service was super friendly.,1
802,Why are these sad little vegetables so overcooked?,0
803,This place was such a nice surprise!,1
804,They were golden-crispy and delicious.,1
805,"I had high hopes for this place since the burgers are cooked over a charcoal grill, but unfortunately the taste fell flat, way flat.",0
806,I could eat their bruschetta all day it is devine.,1
807,Not a single employee came out to see if we were OK or even needed a water refill once they finally served us our food.,0
808,"Lastly, the mozzarella sticks, they were the best thing we ordered.",1
809,"The first time I ever came here I had an amazing experience, I still tell people how awesome the duck was.",1
810,The server was very negligent of our needs and made us feel very unwelcome... I would not suggest this place!,0
811,The service was terrible though.,0
812,"This place is overpriced, not consistent with their boba, and it really is OVERPRICED!",0
813,It was packed!!,0
814,I love this place.,1
815,I can say that the desserts were yummy.,1
816,The food was terrible.,0
817,The seasonal fruit was fresh white peach puree.,1
818,It kept getting worse and worse so now I'm officially done.,0
819,This place should honestly be blown up.,0
820,But I definitely would not eat here again.,0
821,Do not waste your money here!,0
822,I love that they put their food in nice plastic containers as opposed to cramming it in little paper takeout boxes.,1
823,The crêpe was delicate and thin and moist.,1
824,Awful service.,0
825,Won't ever go here again.,0
826,Food quality has been horrible.,0
827,For that price I can think of a few place I would have much rather gone.,0
828,The service here is fair at best.,0
829,"I do love sushi, but I found Kabuki to be over-priced, over-hip and under-services.",0
830,Do yourself a favor and stay away from this dish.,0
831,Very poor service.,0
832,No one at the table thought the food was above average or worth the wait that we had for it.,0
833,"Best service and food ever, Maria our server was so good and friendly she made our day.",1
834,They were excellent.,1
835,I paid the bill but did not tip because I felt the server did a terrible job.,0
836,Just had lunch here and had a great experience.,1
837,I have never had such bland food which surprised me considering the article we read focused so much on their spices and flavor.,0
838,Food is way overpriced and portions are fucking small.,0
839,I recently tried Caballero's and I have been back every week since!,1
840,"for 40 bucks a head, i really expect better food.",0
841,The food came out at a good pace.,1
842,"I ate there twice on my last visit, and especially enjoyed the salmon salad.",1
843,I won't be back.,0
844,We could not believe how dirty the oysters were!,0
845,This place deserves no stars.,0
846,I would not recommend this place.,0
847,"In fact I'm going to round up to 4 stars, just because she was so awesome.",1
848,"To my disbelief, each dish qualified as the worst version of these foods I have ever tasted.",0
849,"Bad day or not, I have a very low tolerance for rude customer service people, it is your job to be nice and polite, wash dishes otherwise!!",0
850,the potatoes were great and so was the biscuit.,1
851,I probably would not go here again.,0
852,So flavorful and has just the perfect amount of heat.,1
853,The price is reasonable and the service is great.,1
854,"The Wife hated her meal (coconut shrimp), and our friends really did not enjoy their meals, either.",0
855,My fella got the huevos rancheros and they didn't look too appealing.,0
856,"Went in for happy hour, great list of wines.",1
857,Some may say this buffet is pricey but I think you get what you pay for and this place you are getting quite a lot!,1
858,I probably won't be coming back here.,0
859,Worst food/service I've had in a while.,0
860,"This place is pretty good, nice little vibe in the restaurant.",1
861,Talk about great customer service of course we will be back.,1
862,"Hot dishes are not hot, cold dishes are close to room temp.I watched staff prepare food with BARE HANDS, no gloves.Everything is deep fried in oil.",0
863,I love their fries and their beans.,1
864,Always a pleasure dealing with him.,1
865,"They have a plethora of salads and sandwiches, and everything I've tried gets my seal of approval.",1
866,This place is awesome if you want something light and healthy during the summer.,1
867,"For sushi on the Strip, this is the place to go.",1
868,"The service was great, even the manager came and helped with our table.",1
869,The feel of the dining room was more college cooking course than high class dining and the service was slow at best.,0
870,"I started this review with two stars, but I'm editing it to give it only one.",0
871,this is the worst sushi i have ever eat besides Costco's.,0
872,"All in all an excellent restaurant highlighted by great service, a unique menu, and a beautiful setting.",1
873,My boyfriend and i sat at the bar and had a completely delightful experience.,1
874,Weird vibe from owners.,0
875,There was hardly any meat.,0
876,I've had better bagels from the grocery store.,0
877,Go To Place for Gyros.,1
878,"I love the owner/chef, his one authentic Japanese cool dude!",1
879,"Now the burgers aren't as good, the pizza which used to be amazing is doughy and flavorless.",0
880,I found a six inch long piece of wire in my salsa.,0
881,"The service was terrible, food was mediocre.",0
882,We definately enjoyed ourselves.,1
883,I ordered Albondigas soup - which was just warm - and tasted like tomato soup with frozen meatballs.,0
884,"On three different occasions I asked for well done or medium well, and all three times I got the bloodiest piece of meat on my plate.",0
885,I had about two bites and refused to eat anymore.,0
886,The service was extremely slow.,0
887,"After 20 minutes wait, I got a table.",0
888,Seriously killer hot chai latte.,1
889,"No allergy warnings on the menu, and the waitress had absolutely no clue as to which meals did or did not contain peanuts.",0
890,My boyfriend tried the Mediterranean Chicken Salad and fell in love.,1
891,Their rotating beers on tap is also a highlight of this place.,1
892,Pricing is a bit of a concern at Mellow Mushroom.,0
893,Worst Thai ever.,0
894,If you stay in Vegas you must get breakfast here at least once.,1
895,I want to first say our server was great and we had perfect service.,1
896,The pizza selections are good.,1
897,"I had strawberry tea, which was good.",1
898,Highly unprofessional and rude to a loyal patron!,0
899,"Overall, a great experience.",1
900,আপনার অর্থ অন্যত্র ব্যয় করুন।,0
901,Their regular toasted bread was equally satisfying with the occasional pats of butter... Mmmm...!,1
902,The Buffet at Bellagio was far from what I anticipated.,0
903,"And the drinks are WEAK, people!",0
904,-My order was not correct.,0
905,"এছাড়াও, আমার মনে হয় চিপগুলি ঘরে বসে তৈরি নয়।",0
906,After the disappointing dinner we went elsewhere for dessert.,0
907,The chips and sals a here is amazing!!!!!!!!!!!!!!!!!!!,1
908,We won't be returning.,0
909,এটি আমার নতুন ফেভ ভেগাস বুফে স্পট।,1
910,আমি গুরুত্ব সহকারে বিশ্বাস করতে পারি না যে মালিকের এমন অনেক অনভিজ্ঞ কর্মচারী রয়েছে যে সমস্ত মাথা ছিন্ন করে মুরগীর মতো ঘুরে বেড়াচ্ছে।,0
911,"Very, very sad.",0
912,"i felt insulted and disrespected, how could you talk and judge another human being like that?",0
913,"How can you call yourself a steakhouse if you can't properly cook a steak, I don't understand!",0
914,I'm not impressed with the concept or the food.,0
915,The only thing I wasn't too crazy about was their guacamole as I don't like it puréed.,0
916,"পোস্টিনোতে আমার পক্ষে আসলে কিছুই নেই, আশা করি আপনার অভিজ্ঞতা আরও ভাল",0
917,I got food poisoning here at the buffet.,0
918,তারা ফ্রাইগুলির একটি নতুন ব্যাচ নিয়ে এসেছিল এবং আমি হ্যাঁ কিছু গরম ভাবছি কিন্তু না!,0
919,"ক্রিসমাসের প্রাকৃতিক অনুষ্ঠানের স্মরণে রাখার জন্য যে হাসিখুশি, মুখরোচক খাবার ছিল তা আমাদের জন্য পুরো ট্রিপের বৃহত্তম ব্যর্থতা ছিল।",0
920,"বলার অপেক্ষা রাখে না, আমি শীঘ্রই আর ফিরে যাব না।",0
921,এই জায়গাটি জঘন্য!,0
922,"Every time I eat here, I see caring teamwork to a professional degree.",1
923,The RI style calamari was a joke.,0
924,"তবে, স্নেহে এত রসুন ছিল, এটি সবেমাত্র ভোজ্য।",0
925,"I could barely stomach the meal, but didn't complain because it was a business lunch.",0
926,"এটা খুব খারাপ ছিল, আমি এটি শেষ করতে হৃদয় হারিয়েছিলাম।",0
927,It also took her forever to bring us the check when we asked for it.,0
928,আমরা রেস্তোঁরাগুলিতে দৃশ্যধারণ করার মতো লোক নই তবে আমি কেবল এটি পাই না ... অবশ্যই এটির পরে ভালবাসা হারিয়েছি!,0
929,হতাশাজনক অভিজ্ঞতা।,0
930,"The food is about on par with Denny's, which is to say, not good at all.",0
931,"আপনি যদি মাঝারি খাবার এবং নিখুঁত ভয়ঙ্কর পরিষেবাটির জন্য অপেক্ষা করতে চান, তবে এটি আপনার জন্য জায়গা।",0
932,WAAAAAAyyyyyyyyyy over rated is all I am saying.,0
933,We won't be going back.,0
934,The place was fairly clean but the food simply wasn't worth it.,0
935,This place lacked style!!,0
936,"The sangria was about half of a glass wine full and was $12, ridiculous.",0
937,এখানে আসা বিরক্ত করবেন না।,0
938,"মাংসটি বেশ শুকনো ছিল, আমি কাটা ব্রিসকেট এবং টুকরা শুকরের মাংস পেয়েছিলাম।",0
939,"বিল্ডিং নিজেই বেশ ঝরঝরে মনে হচ্ছে, বাথরুমটি বেশ ট্রিপল, তবে আমি এখানে আর খেতে পারব না।",0
940,It was equally awful.,0
941,Probably not in a hurry to go back.,0
942,এমনকি রিজার্ভেশন সহ বসার সময় খুব ধীর।,0
943,কল্পনা কোনও প্রসারিত দ্বারা ভাল না।,0
944,কাজু ক্রিম সস মজাদার ছিল এবং শাকসবজি খেয়ে ফেলেছিল।,0
945,"চিপটল পশুর ডুবানো সসটি স্বাদহীন, পাতলা বলে মনে হয় এবং কোনও তাপ ছাড়াই নামিয়ে দেওয়া হয়েছিল।",0
