,Review,Liked
156,এটি অন্য দিন টুকরোটির চেয়ে আলাদা কাট ছিল তবে এখনও দুর্দান্ত এবং স্নেহধারা হিসাবে ভাল v,1
157,আমি ভুডো পাস্তা অর্ডার করেছি এবং বেশ কয়েক বছর আগে আঠালো ফ্রি যাওয়ার পরে প্রথমবারের মতো আমি সত্যিই দুর্দান্ত পাস্তা পেয়েছিলাম।,1
158,এই জায়গা ভাল।,1
159,"দুর্ভাগ্যক্রমে, আমরা অবশ্যই বাকী দিন বেকারিটিকে আঘাত করতে পারি কারণ আমরা যে আদেশ দিয়েছি তা সমস্ত স্টেইল ছিল।",0
160,তারা স্থানান্তরিত এবং এখনও মুগ্ধ না হওয়ার পরে আমি আজ ফিরে এসেছি।,0
161,আমি সঙ্গে সঙ্গে বসলাম।,1
162,তাদের মেনুটি বিবিধ এবং যুক্তিসঙ্গত দামযুক্ত।,1
163,এড়ানো যাই হোক না কেন!,0
164,রেস্তোঁরা সর্বদা পূর্ণ তবে কখনই অপেক্ষা নয়।,1
165,সুস্বাদু !!,1
166,এই জায়গাটি হ'ল ফিনিক্স মেট্রো অঞ্চলে খেতে সেরা স্থানগুলির মধ্যে একটি।,1
167,আপনি যদি ভাল খাবার সন্ধান করেন তবে সেখানে যাবেন না ...,0
168,আমার সাথে এত খারাপ আচরণ কখনও হয় নি।,0
169,বেকন হেলা নোনতা।,1
170,"আমরা পালং শাক এবং অ্যাভোকাডো সালাদও অর্ডার করেছি, উপাদানগুলি দু: খজনক ছিল এবং ড্রেসিংয়ের আক্ষরিক শূন্য স্বাদ ছিল।",0
171,"এটি সত্যিই ভেগাস সূক্ষ্ম ডাইনিং হিসাবে ব্যবহৃত হত, ঠিক কোনও দাম তালিকাভুক্ত মহিলাদের হাতে মেনুগুলিতে দেওয়া হবে।",1
172,ওয়েট্রেসগুলি খুব বন্ধুত্বপূর্ণ।,1
173,"লর্ডি, খাও সোই এমন একটি থালা যা কারি প্রেমীদের জন্য মিস করা উচিত নয়!",1
174,মেনুতে থাকা সমস্ত কিছু দুর্দান্ত এবং আমরা আমাদেরও শিহরিত করেছিলাম যে তারা আমাদের নিরামিষ কন্যার জন্য আশ্চর্যজনক ব্যবস্থা করেছে।,1
175,"অন্যান্য পর্যালোচনা দ্বারা বিচার করার জন্য আমি এগুলিকে রাতে ধরা দিয়েছিলাম, কিন্তু আমি ফিরে যেতে অনুপ্রাণিত হই না।",0
176,এখানে পরিষেবাটি পছন্দসই হওয়ার জন্য অনেক কিছু ছেড়ে যায়।,0
177,স্বাচ্ছন্দ্যের স্পর্শ বজায় রেখে বায়ুমণ্ডলটি আধুনিক এবং নিতম্বপূর্ণ।,1
178,"সাপ্তাহিক হান্ট নয়, অবশ্যই একবারে একবারে ফিরে আসার জায়গা।",1
179,কেউ আমাদের অর্ডার নিতে কেউ জিজ্ঞাসা না করে আমরা আক্ষরিকভাবে সেখানে 20 মিনিটের জন্য বসেছিলাম।,0
180,"বার্গারের একেবারে কোনও স্বাদ ছিল না - মাংস নিজেই পুরোপুরি কোমল ছিল, বার্গারটি overcooked ছিল এবং কোনও কাঠকয়লার স্বাদ ছিল না।",0
181,আমি আবারও এটি প্রেরণ না করার সিদ্ধান্ত নিয়েছি কারণ আমাদের ওয়েট্রেস দেখে মনে হচ্ছে তিনি হার্ট অ্যাটাকের পথে।,0
182,আমি এত অভদ্র আচরণ করা সজ্জিত!,0
183,এটা সম্ভবত ময়লা ছিল।,0
184,"এই জায়গাটি পছন্দ করুন, আমি যখন স্বাস্থ্যকর কিছু চাই তবে স্পষ্টতাকে হিট করে তবে পরিমাণ বা গন্ধের অভাব হয় না।",1
185,আমি লেবু রাস্পবেরি আইস ককটেল অর্ডার করেছি যা অবিশ্বাস্যও ছিল।,1
186,"খাবারটি চুষে ফেলেছিল, যা আমরা প্রত্যাশা করেছিলাম তবে এটি আমাদের কল্পনার চেয়েও বেশি স্তন্যপান করেছিল।",0
187,আকর্ষণীয় সজ্জা।,1
188,আমি সত্যিই যা পছন্দ করি সেখানে ক্রেপ স্টেশন আছে।,1
189,"এছাড়াও পরিবেশন করা হয় গরম রুটি এবং মাখন, এবং বাড়িতে তৈরি আলু চিপস উপর বেকন বিট সহ .... খুব আসল এবং খুব ভাল।",1
190,আপনি তাদের সুস্বাদু খাবার প্রস্তুত করতে দেখতে পারেন!),1
191,ডিমের দুটি রোলই ছিল দুর্দান্ত।,1
192,আমার অর্ডার এলে একজন গাইরো নিখোঁজ ছিল।,0
193,"আমার ডানাগুলির সাথে একটি সালাদ ছিল, এবং ডেজার্টের জন্য কিছু আইসক্রিম এবং বাম বেশ সন্তুষ্ট বোধ করছিল।",1
194,ফিনিক্স ম্যাগাজিনের পাঠকরা কীভাবে জোকে উপত্যকার সেরা হট ডগ হিসাবে নির্বাচিত করেছিলেন তা আমি সত্যিই নিশ্চিত নই।,0
195,ফো এর সুস্বাদু বাটিতে যাওয়ার সেরা জায়গা!,1
196,শুক্রবার সরাসরি সঙ্গীত পুরোপুরি ফুঁসে উঠেছে।,0
197,আমি কখনও বেশি অপমানিত বা অসম্মানিত হইনি felt,0
198,খুব বন্ধুত্বপূর্ণ কর্মী।,1
199,এটা ড্রাইভ মূল্য।,1
200,"আমি এই জায়গা সম্পর্কে ভাল জিনিস শুনেছি, কিন্তু এটি আমি আশা করতে পারে প্রতিটি আশা ছাড়িয়ে গেছে।",1
201,খাদ্য দুর্দান্ত ছিল এবং তাই পরিষেবা ছিল!,1
202,উষ্ণ বিয়ার সাহায্য করেনি।,0
203,দুর্দান্ত ব্রাঞ্চ স্পট।,1
204,পরিষেবা বন্ধুত্বপূর্ণ এবং আমন্ত্রণমূলক।,1
205,খুব ভাল লাঞ্চ স্পট।,1
206,আমি এখানে 1979 সাল থেকে বসবাস করেছি এবং এই জায়গাটিতে পা রাখার এটিই প্রথম (এবং শেষ) সময় ছিল।,0
207,সর্বকালের সবচেয়ে অভিজ্ঞতাই।,0
208,এই জায়গায় অবশ্যই অফ অফ নাইট হওয়া উচিত।,0
209,"পক্ষগুলি সুস্বাদু - মিশ্র মাশরুম, ইউকন সোনার পুরি, সাদা কর্ন - সুন্দর।",1
210,যদি এই বাগটি কখনও না দেখা যায় তবে আমি অবশ্যই একটি 4 দিয়ে দিতাম তবে প্রাচীরের অন্যদিকে যেখানে এই বাগটি আরোহণ করছে সেটি ছিল রান্নাঘর।,0
211,"প্রায় 10 মিনিটের জন্য, আমরা যখন বুঝতে পারি যে এটি শীঘ্রই কোনও সময় আসছে না তখন আমরা তার সালাদের জন্য অপেক্ষা করছি।",0
212,আমার বন্ধু সালমন টার্টার পছন্দ করত।,1
213,ফিরে যাবে না।,0
214,চরম সুস্বাদু!,1
215,ওয়েট্রেস যদিও ভাল ছিল!,1
216,সোগি এবং ভাল না।,0
217,জামাইকার মোজিটোগুলি সুস্বাদু।,1
218,যা ছোট এবং দামের মতো নয়।,0
219,- খাবার সমৃদ্ধ তাই সেই অনুযায়ী অর্ডার করুন।,1
220,"ঝরনা ক্ষেত্রটি বাইরে রয়েছে সুতরাং আপনি কেবল ধুয়ে ফেলতে পারেন, পুরো ঝরনা নিতে পারবেন না, যদি না আপনি সবার দেখার জন্য নগ্ন হয়ে কিছু মনে করেন না!",0
221,পরিষেবাটিতে কিছুটা অভাব ছিল।,0
222,"লবস্টার বিস্ক, ব্রাসেল স্প্রাউটস, রিসোটো, ফাইল্ট সবগুলিতে নুন এবং গোলমরিচ দরকার ছিল .. এবং অবশ্যই টেবিলে কিছুই নেই।",0
223,আশা করি তাদের ব্যবসায়ের বাইরে যাওয়ার জন্য এই মস্তকগুলি এবং যে কেউ রান্না করতে পারে সে ভিতরে আসতে পারে।,0
224,"এটি হয় খুব ঠান্ডা, পর্যাপ্ত স্বাদ বা ঠিক খারাপ ছিল না।",0
225,আমি বেকন মোড়ানো খেজুর পছন্দ।,1
226,এটি একটি অবিশ্বাস্য বরগাইন!,1
227,অট্টোর লোকেরা আমাদের সর্বদা তাই স্বাগত জানায় এবং বিশেষ বোধ করে।,1
228,"""মাইনস"" হিসাবেও নিরবচ্ছিন্ন।",0
229,এটি সেই জায়গা যেখানে আমি প্রথম ফো ছিল এবং এটি আশ্চর্যজনক ছিল !!,1
230,আমরা যখনই আবার শহরে থাকি তখন এই চমত্কার অভিজ্ঞতা এই জায়গাটিকে অবশ্যই থামিয়ে দেয়।,1
231,যদি খাবারটি আপনার পক্ষে যথেষ্ট খারাপ না হয় তবে বিশ্বের সবচেয়ে খারাপ / বিরক্তিকর মাতাল লোকদের সাথে আচরণ করা উপভোগ করুন।,0
232,খুব মজাদার শেফ,1
233,"ডাবল পিজারবার্গারকে নির্দেশ দিয়েছিলেন এবং এমন একক প্যাটি পেয়েছেন যা ভেঙে পড়ছে (ছবি আপলোড করা হয়েছে) হ্যাঁ, এখনও চুষছে।",0
234,একটি দম্পতি পানীয় পান করার জন্য দুর্দান্ত জায়গা এবং টিভির দেয়ালগুলি আবৃত হওয়ায় কোনও ক্রীড়া ইভেন্ট দেখার জন্য।,1
235,যদি তাদের শূন্য নক্ষত্র দেওয়া সম্ভব হত তবে তারা তা পেত।,0
236,"বর্ণনায় ""ইয়ম ইয়ম সস"" এবং অন্যজন ""আইল সস"" বলেছিলেন, অন্য একজন ""মশলাদার মায়ো"" বলেছেন ... ভাল রোলগুলির কোনওটিতেই সস ছিল না।",0
237,"আমি বলব যে এটি সবচেয়ে কঠিন সিদ্ধান্ত হবে ... সত্যি বলতে, এম এর সমস্ত খাবারগুলি কীভাবে তাদের স্বাদে আশ্চর্যজনক (আশ্চর্যজনক) স্বাদ হয়।",1
238,তিনি যদি চোখ না ঘামিয়ে থাকেন তবে আমরা থাকতেই পারি ... আমরা ফিরে গিয়ে আবার চেষ্টা করব কিনা তা নিশ্চিত নয়।,0
239,"প্রত্যেকেই খুব মনোযোগী, দুর্দান্ত গ্রাহক পরিষেবা সরবরাহ করছে।",1
240,ভয়াবহ - আপনার সময় এবং অর্থ অপচয় করবেন না।,0
241,এখন এই থালাটি বেশ স্বাদযুক্ত ছিল।,1
242,এতক্ষণে রেস্তোঁরাটির পাশটি প্রায় খালি ছিল তাই কোনও বাহানা ছিল না was,0
243,"(এটি কোনও ব্যস্ত ছিল না) এছাড়াও, ভবনটি শীতল শীতল ছিল।",0
244,"অন্যান্য পর্যালোচক যেমন বলেছিলেন ""আপনি আমাকে এই জায়গায় আবার খেতে দিতে পারেন না।""",0
245,-ড্রিংস এক পর্যায়ে বাইরে আসতে 30 মিনিটের কাছাকাছি সময় নেয়।,0
246,"গুরুতরভাবে স্বাদযুক্ত আনন্দ, লোকেরা।",1
247,আমি অন্যান্য VeYCE এর সুশী জায়গার চেয়ে অনেক ভাল better,1
248,মেজাজ সেট করার জন্য আলো কেবল অন্ধকার।,1
249,আমি যে উপ-সম-পরিষেবাটি পেয়েছি তার উপর ভিত্তি করে এবং আমার ব্যবসায়ের প্রতি তাদের কৃতজ্ঞতা দেখানোর কোনও প্রচেষ্টা আমি আর ফিরে যাব না।,0
250,মালিকরা আসলেই দুর্দান্ত মানুষ!,1
251,সেখানে কাজ / খাওয়ার বিষয়ে কোনও সুযোগ সুবিধা নেই।,0
252,গ্রীক ড্রেসিং ছিল খুব ক্রিমযুক্ত এবং স্বাদযুক্ত।,1
253,"সামগ্রিকভাবে, আমি মনে করি না যে আমি আমার পিতামাতাকে আবার এই জায়গায় নিয়ে যাব কারণ তারা বেশিরভাগ অনুরূপ অভিযোগ করেছিল যা আমি চুপ করেই অনুভব করেছি।",0
254,এখন পিজ্জা নিজেই ভাল ছিল চিনাবাদামের সস খুব সুস্বাদু ছিল।,1
255,আমাদের টেবিলে আমাদের 7 ছিল এবং পরিষেবাটি খুব দ্রুত ছিল।,1
256,এখানে চমত্কার পরিষেবা।,1
257,আমিও সম্ভব হলে গডফাদারদের শূন্য নক্ষত্র দেব।,0
258,তাদের এখানে কীভাবে তৈরি করা যায় তা তারা জানে।,1
259,খুব শক্ত এবং স্বাদে খুব সংক্ষিপ্ত!,0
260,আমি আশা করি এই জায়গাটি প্রায় লাঠি ধরেছে।,1
261,আমি ভেগাসে কয়েকটি বারেরও বেশি ছিলাম এবং ট্যাপ জলের জন্য কখনই চার্জ আদায় করার কথা মনে করি না।,0
262,রেস্তোঁরাটির পরিবেশটি ছিল দুর্দান্ত।,1
263,"বুট করার জন্য ভাল পরিসেবা, খুব পরিষ্কার এবং সস্তা and",1
264,সামুদ্রিক খাবার টাটকা এবং উদার ছিল।,1
265,"এছাড়াও, এটি 8 টাকা মাত্র।",1
266,পরিষেবাটিও সমান ছিল না।,0
267,এখনও অবধি কেবল দুবার পরিদর্শন করেছেন এবং প্রতিবারই খাবারটি একেবারে সুস্বাদু ছিল।,1
268,এক বছরেরও বেশি আগে যখন ছিলাম ঠিক তেমনি ভালো!,1
269,"একটি স্ব ঘোষিত কফি ক্যাফের জন্য, আমি বন্যভাবে হতাশ ছিলাম।",0
270,নিরামিষাশী থালাটি এই পৃথিবীর বাইরে!,1
271,আপনি এখানে কোনও খাবারের সাথে ভুল করতে পারবেন না।,1
272,আপনি এটি মারতে পারবেন না।,1
273,"আয়রনম্যানের হয়ে ম্যাডিসনে থাকাকালীন এই জায়গাটি থামানো হয়েছে, অত্যন্ত বন্ধুত্বপূর্ণ, সদয় কর্মী।",1
274,শেফরা বন্ধুত্বপূর্ণ ছিল এবং একটি ভাল কাজ করেছে।,1
275,"আমি কেবল উত্সর্গীকৃত বোবা চা স্পটগুলি থেকে নয়, এমনকি জেনি ফো থেকেও ভাল করেছি।",0
276,আমি প্যাটিওটি পছন্দ করেছি এবং পরিষেবাটি অসামান্য ছিল।,1
277,ছাগল টাকো মাংসের উপর ঝাঁপিয়ে পড়ে না এবং বাহ কি স্বাদ!,1
278,আমি আবার না বলে মনে করি,0
279,আমার কাছে ম্যাক সালাদ ছিল এবং এটি বেশ নরম ছিল তাই আমি আর তা পাব না।,0
280,আমি বন্ধুর পরামর্শে বাচি বার্গারে গিয়েছিলাম এবং হতাশ হইনি।,1
281,পরিষেবা এখানে দুর্গন্ধ!,0
282,আমি অপেক্ষা করে অপেক্ষা করলাম।,0
283,"এই জায়গাটি মানের সুশি নয়, এটি কোনও মানের রেস্তোঁরা নয়।",0
284,আমি অবশ্যই পিজ্জার পাশাপাশি উইংসের সুপারিশ করব।,1
285,দুর্দান্ত পিজ্জা এবং সালাদ!,1
286,যে জিনিসগুলি ভুল হয়েছে: - তারা সাগানাকি জ্বালিয়ে দিয়েছে।,0
287,আমরা ঘরে নাস্তাটি করার জন্য এক ঘন্টা অপেক্ষা করেছিলাম যা আমি ঘরে 100 গুণ ভাল করতে পারতাম।,0
288,এই জায়গাটি আশ্চর্যজনক!,1
289,"আমি আমার সহযোদ্ধাদের সাথে দ্বিমত পোষণ করতে ঘৃণা করি, তবে আমি এবং আমার স্বামী এই জায়গাটি নিয়ে এতটাই হতাশ হয়েছিলাম।",0
290,"2 ঘন্টা অপেক্ষা করেছেন এবং আমাদের চারপাশের অন্যান্য যারা পরে এসেছিলেন, আমাদের পিজ্জার কোনওটিই পান নি!",0
291,কেন তারা এত ধীর ছিল তা শুধু জানেন না।,0
292,"কর্মীরা দুর্দান্ত, খাবার সুস্বাদু এবং তাদের একটি বিস্ময়কর বিয়ার নির্বাচন রয়েছে।",1
293,"আমি আশেপাশে থাকি তাই হতাশ হয়ে আমি আর ফিরে আসব না, কারণ এটি সুবিধাজনক জায়গা।",0
294,আমি জানতাম না টানা শুয়োরের মাংস খুব সুস্বাদু হতে পারে।,1
295,আপনি যত্ন সহ প্রস্তুত অবিশ্বাস্যভাবে তাজা মাছ পান।,1
296,আমি কেন 1 টি তারকা রেটিং দিয়েছি তার আগে আমি দয়া করে জেনে রাখুন যে এটি আমার তৃতীয় বার বাচ্চা বার্গারে খাওয়া একটি পর্যালোচনা লেখার আগে।,0
297,আমি এই সত্যটি পছন্দ করি যে তাদের মেনুতে থাকা সমস্ত কিছুর জন্য মূল্যবান।,1
298,আমি আর কখনও এই জায়গায় খাওয়া হবে না!,0
299,খাবারটি দুর্দান্ত ছিল এবং পরিষেবাটি খুব ভাল ছিল।,1
300,ভাল বিয়ার এবং পানীয় পানীয় এবং ভাল খাদ্য নির্বাচন।,1
301,চিংড়ি নাড়ুন ভাজা নুডলস থেকে দূরে থাকুন।,0
302,আলু চিপের ক্রমটি দুঃখজনক ছিল ... আমি সম্ভবত সেই বাক্সে কতগুলি চিপ ছিল তা গণনা করতে পারি এবং এটি সম্ভবত 12 এর কাছাকাছি।,0
303,খাবার সত্যিই বিরক্তিকর ছিল।,0
304,ভাল পরিষেবা-চেক!,1
305,এই লোভী কর্পোরেশন আমার কাছ থেকে আর কোনও ডাইম দেখতে পাবে না!,0
306,"কখনও হবে না, কখনও ফিরে যেতে হবে।",0
307,"আমি যতটা ফিরে যেতে চাই, আমি অত্যাচারী পরিষেবাটি পাস করতে পারি না এবং কখনই ফিরে আসব না।",0
308,"গ্রীষ্মে, আপনি একটি আকর্ষণীয় বহিরঙ্গন প্যাশিয়ায় খাবার খেতে পারেন - খুব আনন্দদায়ক।",1
309,আমি এই এত ভাল হবে আশা করি না!,1
310,চমত্কার খাবার!,1
311,তিনি টোস্টেড ইংলিশ মাফিন অর্ডার করলেন যা টোস্টে বেরিয়ে এসেছে।,0
312,খাবারটি খুব ভাল ছিল.,1
